{
  "schema": "https://oddkin.dev/schemas/conformance-result/v1.json",
  "suite": {
    "id": "oddkin.button",
    "version": "0.1.0"
  },
  "implementation": {
    "tag": "studio-button",
    "package": "@acme/studio-ui",
    "definition": "studioButtonDefinition"
  },
  "configuration": {
    "theme": "studio",
    "product": "studio",
    "density": "comfortable"
  },
  "environment": {
    "userAgent": "Mozilla/5.0 (fixture)"
  },
  "date": "2026-10-17T22:00:00.000Z",
  "results": [
    {
      "case": "native-control",
      "state": "passed"
    },
    {
      "case": "reconnect",
      "state": "failed",
      "message": "expected 6 to be 1"
    },
    {
      "case": "theme-value",
      "state": "not-executed"
    }
  ]
}
